{
  "$schema": "../template.schema.json",
  "name": "v4",
  "deprecated": true,
  "description": "Minimal setup for Nuxt 4",
  "defaultDir": "nuxt-app",
  "url": "https://nuxt.com",
  "tar": "https://codeload.github.com/nuxt/starter/tar.gz/refs/heads/v4",
  "repo": "nuxt/starter",
  "branch": "v4"
}
