{
  "$schema": "../template.schema.json",
  "name": "v5-nightly",
  "description": "Minimal setup for Nuxt 5 Nightly",
  "defaultDir": "nuxt-nightly",
  "url": "https://nuxt.com",
  "tar": "https://codeload.github.com/nuxt/starter/tar.gz/refs/heads/v5-nightly",
  "repo": "nuxt/starter",
  "branch": "v5-nightly"
}
