{
  "$schema": "../template.schema.json",
  "name": "module-devtools",
  "deprecated": true,
  "description": "Nuxt module with DevTools integration",
  "defaultDir": "nuxt-module",
  "url": "https://nuxt.com",
  "tar": "https://codeload.github.com/nuxt/starter/tar.gz/refs/heads/module-devtools",
  "repo": "nuxt/starter",
  "branch": "module-devtools"
}
