{
  "$schema": "../template.schema.json",
  "name": "minimal",
  "label": "Nuxt 4",
  "default": true,
  "description": "Minimal starter with a single app.vue.",
  "image": "data:image/svg+xml,%3Csvg xmlns='http://www.w3.org/2000/svg' width='34' height='34' viewBox='0 0 34 34' fill='none'%3E%3Cpath d='M19.0778 28.3333H31.6956C32.0993 28.3364 32.4968 28.2333 32.8482 28.0344C33.1996 27.8355 33.4926 27.5478 33.6978 27.2C33.8967 26.8554 34.0015 26.4645 34.0015 26.0667C34.0015 25.6688 33.8967 25.2779 33.6978 24.9333L25.1978 10.3511C24.9987 10.0063 24.7124 9.72003 24.3675 9.52108C24.0226 9.32213 23.6315 9.21751 23.2333 9.21777C22.8296 9.2147 22.4321 9.31778 22.0807 9.51669C21.7293 9.71559 21.4363 10.0033 21.2311 10.3511L19.0778 14.0911L14.8467 6.79999C14.6445 6.44959 14.3521 6.1597 14 5.96041C13.648 5.76112 13.249 5.65969 12.8445 5.66666C12.4471 5.67016 12.0574 5.77635 11.7132 5.97494C11.369 6.17352 11.0819 6.45774 10.88 6.79999L0.302233 24.9333C0.153235 25.1913 0.056538 25.476 0.0176701 25.7714C-0.0211977 26.0667 -0.00147386 26.3668 0.075714 26.6545C0.152902 26.9422 0.28604 27.2118 0.467516 27.4481C0.648992 27.6843 0.875247 27.8824 1.13334 28.0311C1.47334 28.22 1.8889 28.3333 2.30446 28.3333H10.2378C13.3733 28.3333 15.6778 26.9733 17.2645 24.2911L21.1556 17.6422L23.2333 14.0911L29.4667 24.7822H21.1556L19.0778 28.3333ZM10.0867 24.7822H4.57112L12.8445 10.54L17 17.6422L14.2045 22.4022C13.1467 24.14 11.9756 24.7822 10.0867 24.7822Z' fill='%2300DC82'/%3E%3C/svg%3E",
  "defaultDir": "nuxt-app",
  "url": "https://nuxt.com/docs/getting-started/installation",
  "tar": "https://codeload.github.com/nuxt/starter/tar.gz/refs/heads/v4",
  "repo": "nuxt/starter",
  "branch": "v4"
}
