{
  "$schema": "../template.schema.json",
  "name": "doc-driven",
  "deprecated": true,
  "description": "Document-driven website",
  "defaultDir": "nuxt-app",
  "url": "https://content.nuxt.com",
  "tar": "https://codeload.github.com/nuxt/starter/tar.gz/refs/heads/doc-driven",
  "repo": "nuxt/starter",
  "branch": "doc-driven"
}
