{
  "$schema": "../template.schema.json",
  "name": "ui",
  "label": "UI",
  "description": "Starter with Nuxt UI.",
  "image": "data:image/svg+xml,%3Csvg xmlns='http://www.w3.org/2000/svg' width='32' height='32' viewBox='0 0 20 20'%3E%3Cpath fill='%2300DC82' fill-rule='evenodd' d='M10 2.5c-1.31 0-2.526.386-3.546 1.051a.75.75 0 0 1-.82-1.256A8 8 0 0 1 18 9a22.47 22.47 0 0 1-1.228 7.351a.75.75 0 1 1-1.417-.49A20.97 20.97 0 0 0 16.5 9A6.5 6.5 0 0 0 10 2.5ZM4.333 4.416a.75.75 0 0 1 .218 1.038A6.466 6.466 0 0 0 3.5 9a7.966 7.966 0 0 1-1.293 4.362a.75.75 0 0 1-1.257-.819A6.466 6.466 0 0 0 2 9c0-1.61.476-3.11 1.295-4.365a.75.75 0 0 1 1.038-.219ZM10 6.12a3 3 0 0 0-3.001 3.041a11.455 11.455 0 0 1-2.697 7.24a.75.75 0 0 1-1.148-.965A9.957 9.957 0 0 0 5.5 9c0-.028.002-.055.004-.082a4.5 4.5 0 0 1 8.996.084v.148l-.005.297a.75.75 0 1 1-1.5-.034c.003-.11.004-.219.005-.328a3 3 0 0 0-3-2.965Zm0 2.13a.75.75 0 0 1 .75.75c0 3.51-1.187 6.745-3.181 9.323a.75.75 0 1 1-1.186-.918A13.687 13.687 0 0 0 9.25 9a.75.75 0 0 1 .75-.75Zm3.529 3.698a.75.75 0 0 1 .584.885a18.883 18.883 0 0 1-2.257 5.84a.75.75 0 1 1-1.29-.764a17.386 17.386 0 0 0 2.078-5.377a.75.75 0 0 1 .885-.584Z' clip-rule='evenodd'/%3E%3C/svg%3E",
  "defaultDir": "nuxt-app",
  "url": "https://ui.nuxt.com",
  "tar": "https://codeload.github.com/nuxt-ui-templates/starter/tar.gz/refs/heads/main",
  "repo": "nuxt-ui-templates/starter",
  "branch": "main"
}
