{
  "$schema": "../template.schema.json",
  "name": "ui-vue",
  "deprecated": true,
  "description": "Use Nuxt UI with a plain Vue website",
  "defaultDir": "vue-app",
  "url": "https://ui.nuxt.com",
  "tar": "https://codeload.github.com/nuxt-ui-templates/starter-vue/tar.gz/refs/heads/main",
  "repo": "nuxt-ui-templates/starter-vue",
  "branch": "main"
}
