{
  "$schema": "../template.schema.json",
  "name": "layer",
  "deprecated": true,
  "description": "Standalone Nuxt layer",
  "defaultDir": "nuxt-layer",
  "url": "https://nuxt.com",
  "tar": "https://codeload.github.com/nuxt/starter/tar.gz/refs/heads/layer",
  "repo": "nuxt/starter",
  "branch": "layer"
}
